{
  "release_id": "11111111-1111-4111-8111-111111111111",
  "version": "1.0.0",
  "os": "linux",
  "architecture": "amd64",
  "kernel_min": "5.6",
  "glibc_min": "2.35",
  "native_libraries": [
    "libc.so.6",
    "libdl.so.2"
  ],
  "api_majors": [
    1
  ],
  "ipc": {
    "min_inclusive": "1.0.0",
    "max_exclusive": "2.0.0"
  },
  "ui_schema": 1,
  "security_floor_version": 1,
  "databases": [
    {
      "name": "critical",
      "read_min": 1,
      "read_max": 1,
      "write_version": 1
    },
    {
      "name": "events",
      "read_min": 1,
      "read_max": 1,
      "write_version": 1
    },
    {
      "name": "history",
      "read_min": 1,
      "read_max": 1,
      "write_version": 1
    }
  ],
  "rollback_release_ids": [],
  "files": [
    {
      "path": "serverdeck-agent",
      "size_bytes": "1",
      "sha256": "0000000000000000000000000000000000000000000000000000000000000000"
    }
  ]
}
